{"mechanism_id":"freshness-hash","source_candidate":"aris","source_commit":"aaaaaaaaaaaaaaaaaaaaaaaaaaaaaaaaaaaaaaaa","source_files":["tools/run_state.py"],"mechanism_summary":"Bind state to dependency hashes.","actual_gap_addressed":"Stale outputs were not invalidated.","baseline_failure":"CASE-005 did not persist a state graph.","candidate_behavior":"A resumable state distinction was statically observed.","proposed_behavior":"Implement a native fail-closed hash graph.","observable_metric":"All changed dependencies propagate STALE.","measured_or_expected_benefit":"Expected to close the observed CASE-005 state gap.","security_risk":"Do not execute source code.","license_status":"MIT_ROOT_WITH_SUBRESOURCE_GAPS","contamination_risk":"Exclude examples.","integration_conflict":"Do not add a second state truth.","reuse_mode":"CLEAN_ROOM_REIMPLEMENT_CANDIDATE","clean_room_requirements":["Implement from the behavioral contract only."],"required_tests":["Dependency mutation propagates STALE."],"maintenance_cost":"MEDIUM","rejected_alternatives":["Direct source copy."],"confidence":"MEDIUM","human_review_required":true}
